id,text,retweet_count,reply_count,like_count
1465498766161498117,"Donald Trump Jr., World-Renowned Moron, Urges Vaccine Protests as Omicron Poses “Very High Risk” - Vanity Fair. He is in a tie with his father as dumbest person on the planet.  https://t.co/k3PtfCnN8c",0,0,0
1465498765272436742,"our prime minister: the vaccines don't work on the new covid variant  

also our prime minister: you need more doses of the same vaccine that doesn't work on the new strain 

cheers mate 👍",0,0,0
1465498762286039043,i think I lost my vaccine card 🚶‍♀️,0,1,0
1465498754958573575,"Save over 50% on our comfy, reusable masks designed by a Seattle RN/Mom https://t.co/SIy3k9NT9e #Vaxxed #VaxAndMask #DesignedbyANurse Show Nurses some Love - vax 
 & wear a mask https://t.co/sbGzLoPCws",0,0,0
1465498754547687424,"Ah yes, Dr.Fauci is FEARED by the Republicans anti science/anti-vaccination “freedom” gobbledegook. The Republicans in Congress are willing to kill off their constituents for a CULT! We see you for the tiny mean minds you are @tedcruz @TomCottonAR @SenRandPaul @WHCOVIDResponse https://t.co/ZQfMmpQyZ8",0,0,0
1465498733576081409,"A Cautionary Message From Vaccine Advocates w/ Dr. Aditi Bhargava, Kyle ... https://t.co/tF9JYO4Utl via @YouTube",0,0,0
1465498722553368580,"#Pfizer 
View: Bullish https://t.co/tClpXW2C8H",0,0,1
1465498719944646657,I don’t care about the drugs but this asshole is selling fake Covid vaccine cards so ppl should report the account tbh idc that’s disgusting https://t.co/nNIsHo6KsP,3,0,6
1465498713980391428,In today's roundup: Robert Jeffress breaks w/court evangelicals on vaccine mandates; what is #BigEva?; the evangelicals who made #Rittenhouse a hero; is @TGC a progressive evangelical organization?; Mike Lindell breaks w/ @SalemMediaGrp; and more: https://t.co/7cQrgDiDPf,0,1,0
1465498701879644163,everyone who wants to be vaccinated is already vaccinated + many will not get the booster due to how we were lied-to about the vaccine preventing covid. https://t.co/ToukhInSjr,0,0,0
1465498701867085827,"https://t.co/iSjGUucmOd

Weekly covid death rate in the U.S. vaccinated vs unvaccinated. You can really see the difference the vaccine makes especially in older people.",0,0,0
1465498699962929153,"The Omicron Covid variant is no excuse for new lockdowns or vaccine mandates, as New York Gov. Kathy Hochul’s damage to hospitals shows. https://t.co/vdCTvdUHY2",0,0,1
1465498689795854337,How are people still supporting vaccine mandates at this point? Are y'all ok?  Does critical thinking elude you or...,0,0,0
1465498681444995082,"I saw on Global News people whining they're stuck in South Africa, a country with a very low vaccination rate, because of Omicron travel restrictions. 

With risk, comes great reward...and punishment. 

Zero sympathy.",0,0,1
1465498680014868481,"There's a quasi-religious quality to the fight over vaccine mandates. Every avenue, including natural immunity and non prophylactic medicines should be being intensely explored. Instead we're lodged in a simplistic, binary rut between the pro-vax puritans & the anti-vax heretics. https://t.co/IhEUcwMsq0",0,0,0
1465498674901835776,"Let me remind you of the other mrna failures, that got Halted, WAY BEFORE this amount of damage was done!!!!😠
 Stop allowing this crap to continue! Enough is Enough!!! 
Please stand up! No forced vax !
This All,is awful in so many ways 💔
#CrimesAgainstHumanity",0,0,0
1465498673975078915,Reverse vaccination technique in mice suggests new way to teach the immune system not to attack lifesaving treatments https://t.co/SiNLkqFdrP via @Yahoo Fascinating.,0,0,0
1465498672897134594,China leader promises Africa 1 billion Covid vaccine doses https://t.co/jo3YyL0Zhv,0,0,0
1465498664667914242,China leader promises Africa 1 billion Covid vaccine doses https://t.co/dWOi67Anv2,0,0,0
1465498664202235905,Because Delta variant is your biggest risk right now and the vaccine helps with that. https://t.co/hl3x86VJL4,0,0,0
1465498662407131147,"Truth in plain view, see the sources for Truth... https://t.co/I2GgKcxmg1
#VaccineMandate #vaccine #VaccineSideEffects #rothschild #Illuminati #Freemasons",0,0,0
1465498662293889025,"Getting my Covid booster next Saturday, and I’ll also have my period. I plan on curling into the fetal position. 

Please make sure you schedule your booster vaccination ASAP. 
Don’t act like you care, put your money where your mouth is.",0,1,1
1465498661916495883,Continue to line the pockets of Moderna & Pfizer https://t.co/L89gKeO9vn,0,0,0
1465498646745600006,"Brockton Parents / All MA Parents:
Sign up to get your child vaccinated here:    https://t.co/zKDR8h9sVQ https://t.co/GISZ4A3IzM",0,0,0
1465498635114725381,"#LISTEN: Life under the incoming traffic light system will look a lot different for the thousands of Kiwis who have so far chosen not to get vaccinated against COVID.

342,000 people are estimated to not have received a vaccine does yet.

See more here: https://t.co/KJtXAzrkwu https://t.co/b2yz36508V",0,2,0
1465498630719082496,"BREAKING: Pfizer is Now Seeking FDA Approval of ‘Booster Shots’ – for Teenagers

Want more news? Also follow @Patriot911News

https://t.co/2vhSjxxB1Q",3,0,4
1465498629356113923,Three Young People in Thailand Die This Week After Reportedly Receiving COVID-19 Vaccine (VIDEO) https://t.co/VO0vs3mjBh via @gatewaypundit,0,0,0
1465498627506376704,Bioweapon Contracts Exposed: Pfizer Making Billions Off EU Tyrannical Mandates https://t.co/1dJifJAUQD,1,0,1
1465498614248222721,"Donald Trump Jr., World-Renowned Moron, Urges Vaccine Protests as Omicron Poses “Very High Risk” - Vanity Fair https://t.co/jfJ54v0XKw",0,0,0
1465498607151456260,Covid booster vaccine deployed over 18 years old https://t.co/xTJBSGmT1F,0,0,0
1465498602160197637,I like your regiment. Been doing the same since the pandemic and have antibodies without symptoms. We’re both fighting off covid with more prowess than the vaccine. 🤷🏻‍♂️ https://t.co/uQbR49Wf4H,0,1,1
1465498599379329028,"This Friday, CTU HQ is open for vax from 3-7 p.m for all eligible children and families ages 5 and up. Second doses from our Nov. 12 vaccination event will be available, as well as booster shots for those 12 and up who have already received both doses. Join us! @CTUFoundation https://t.co/S2ThYNhfWc",4,1,4
1465498595302514695,"JEFFERSON CITY, Mo. (AP) — A federal judge on Monday blocked President Joe Biden's administration from enforcing a coronavirus vaccine mandate on thousands of health care workers in 10 states that had brought the first legal challenge against the re… https://t.co/WXLgVlXl6u",0,0,0
1465498593712693248,Please name the federal Judge who blocked the vaccine mandate for healthcare workers in 10 states. https://t.co/s4duLKgUIa,0,1,1
1465498584980377606,"Exclusive: Forced to Get Vaccine to Remain on Lung Transplant List, 49-Year-Old Who Survived COVID Dies After Second Moderna Shot • Children's Health Defense https://t.co/SJfktngJC2",0,0,0
1465498577216544769,North Shore school boards reject vaccine mandates https://t.co/0kvjU0SJIL https://t.co/kPqM5hCw8v,0,0,1
1465498576788852737,Clinics are now open in British Columbia for children between five and 11 years old to start getting shots of a pediatric COVID-19 vaccine. #covid19bc https://t.co/fKJBY0vnmm,1,5,9
1465498571432681474,"What ‘My Body, My Choice’ Means to the Right https://t.co/xBMJiTfge5",0,0,0
1465498565287944192,"COURT TEMPORARILY HALTS SD UNIFIED'S VACCINE MANDATE OVER RELIGION CHALLENGE

Leftists and @theDemocrats are using #COVID to destroy Christianity.

Faith keeps most of our country from killing one another. Remove it and it's anarchy on all sides. 

https://t.co/kcHToUMkbC",0,0,0
1465498557171986437,"In the US, they are talking about boosters for 16 and 17 year olds. Indian Govt forcibly prevents even old people from getting life-saving boosters.

It's Dec 2021, is there a still a vaccine shortage? https://t.co/ueiSyiruKr",0,1,0
1465498553787334664,"Pfizer says #omicron vaccine can be ready in 100 days

Follow the latest #COVID19 news on Nikkei Asia's free blog. #OmicronVariant
https://t.co/SaHiZrbB1f",1,0,9
1465498534627659777,Got my vaccine booster yesterday!    Am I Sam 3.0 now? https://t.co/RbHNijkBzD,0,1,2
1465498534602366983,"On Nov 25, the Handover ceremony of the COVID-19 vaccine and anti-epidemic supplies from China to Laos was held. The total amount of assistance is 90 million yuan, including 2.5 million doses of COVID-19 vaccines and 10 million yuan of anti-epidemic supplies. https://t.co/yL2MaG0OkC",0,0,0
1465498532366807042,COVID-19 vaccine mandates introduced across schools and childcare centres 'to protect vulnerable Queenslanders' https://t.co/ilW43BEPcm via @ABCaustralia #COVID19 #access2meds #qldpol,0,0,0
1465498511034695681,does anyone have articles for the vaccine so i can prove to my dad so he can just let me get vaccinated,0,2,0
1465498503912767489,"Vaccie Makers should Invent a  Universal vaccine to defeat all variants , Flu strains",0,0,0
1465498503849861133,The mandate requires people to show proof of being fully vaccinated in order to enter a myriad of businesses. https://t.co/HiE61tr3vC,0,0,0
1465498492311384067,"🤔after you get them fired for no vaccine, you want to honor them? 😑
White House 2021 Christmas decorations to honor COVID-19 frontline workers https://t.co/n5XgKHhLwi #FoxNews",0,0,0
1465498486523121664,Court temporarily halts San Diego schools’ COVID-19 vaccine mandate https://t.co/iNeMbbIBUK,1,0,0
1465498479585751045,North Shore school boards have become the latest to reject vaccine mandates for staff https://t.co/CQji8X44fW via @NorthShoreNews,0,0,0
1465498478855872512,"Just muted the words covid, vaccine, and vax https://t.co/04x1FmDl20",0,0,1
1465498471415181314,The Latest COVID Data Offers Yet Another Factual Rejection of COVID Vaccine Effectiveness Narrative https://t.co/ciTveumRli,0,0,1
1465498467963396098,Why did more people die in 2021 despite the rollout of the Vax in December 2020? Did COVID raise the death toll despite mass vaccination or are people dying at increased rates b/c of the Vax?  https://t.co/uNe3ahEJkQ,0,0,0
1465498467938226179,NYC could be in a great position with effective lock down of unvaccinated if the vaccine holds for omicron.,0,0,0
1465498457800691718,"As they await testing to see how well their Covid-19 vaccines work against Omicron, drugmakers have begun expressing concern the shots won’t be as effective and there may be a need for modified doses https://t.co/kS2sWy2Bhm",0,0,1
1465498443112239112,DEATH VACCINE MISSION ACCOMPLISHED ‼️‼️‼️☠️🇺🇸🤬💩🪰👎🏿 https://t.co/nTE49BqJcc,0,0,0
1465498441505775625,Does the vaccine work and we can go back to normal? Or does it not work and we therefore shouldn’t force anyone to get it? Which one is it???,0,0,0
1465498437835579392,"When we arrived at Pleasant Pediatrics early this afternoon for our vaccine appointment, I was surprised to hear they were offering BOOSTERS as well for anyone over 18! Here’s the info to schedule! 💉💗😷:

https://t.co/esT7apDuKL",0,0,2
1465498436472508420,"The Philippines administered 2.45 million COVID vaccine doses on the first day of its national COVID vaccination drive, according to Vaccine Czar Sec. Carlito Galvez Jr.  The gov’t targets to administer a total of 9M doses during the three-day Bayanihan, Bakunahan https://t.co/fXWDNz1bsn",0,0,0
1465498433888817161,"Panic won’t combat the #Omicron variant – let's stay informed & #GetVaccinated. I shared my thoughts on the latest #COVID19 news, including why boosters are necessary during international vaccine rollout, on @BloombergRadio with @carolmassar & @timsteno.

https://t.co/6fkxlxEAIC",0,0,0
1465498426964127751,which is best accomplished by seeing that the rest of the world has easy and universal access to the vaccine. https://t.co/2L6uoBXfuV,0,0,3
1465498422895517701,"You people are crowding concerts and carnivals? I'm in crowds of people queueing for vaccine, how's that 

/sighs",0,1,4
1465498418248310794,Imogen Allen: 22-Year-Old Showjumper Develops Blood Clots 2 Weeks After Receiving Moderna COVID-19 Vaccine #horses #equestrian #pharmaharmed https://t.co/j5uOylHsFa,0,0,0
1465498418000900103,"Judge who understands the Constitution 1
Biden still a 0
https://t.co/CkrwarqDWA",0,0,0
1465498395125366785,First dose vaccine done✨,0,0,0
1465498394303115267,"VAERS data reveals 50-fold increase in ectopic pregnancies following COVID-19 vaccine shots
 https://t.co/N1I5oedfjB

#mondaythoughts #vaccine",0,0,0
1465498393720102913,I’m not anti vax btw.,0,0,0
1465498385163636736,"Vaccines have private protection within 3-6 months of shots, per studies from #Sweden, #Qatar and #Israel. So the premise that vaccination protects others is a fallacy. #VaccineMandate",0,0,0
1465498381493719045,The FDA could authorize Covid-19 boosters from Pfizer and BioNTech for use in 16- and 17-year olds as soon as next week https://t.co/fxIhTV24BH,0,0,1
1465498365446311945,"So glad they held up nurses for 18 months as hero’s, only to throw them away for not getting a vaccine that many had immunity to. Where is the PA senate and House on a bill outlawing vaccine mandates? Anyone know how we are in a global pandemic and are getting rid of hospital… https://t.co/0HqX4J7zoR",0,1,0
1465498353823883265,"As of mid morning today, @crazykuehne and I are officially “boosted” (as well as flu shot).  While everyone has their own opinion/thoughts on the vaccine, and that is your right and mine, I would ask that people at least give it some thought and consider it.",0,0,0
1465498343132569603,Vaccine patents are grossly immoral for so many reasons. https://t.co/ZmJHxPtrw9,0,0,1
1465498341425430533,"New video @BD007Marky  ""AHA Report Confirms the Pfizer and Moderna mRNA Vaccines Cause Heart Damage and a Doctor Verifies the Vaccines Cause AIDS"" https://t.co/qn7QQFIqVT
#mRNAVaccines #AIDS #HeartDamage https://t.co/4A72SjmDCo",0,1,3
1465498337961033728,".@Reddit again pushing straight #antivax propaganda to the frontpage of the internet. You should be held liable for providing a forum for scum like that, instead, you amplify it. #reddit #vaccination #conspiracy https://t.co/X9xmaGmBq0",0,0,0
1465498336941658115,"The @GOP campaign to sabotage Biden's stellar vaccine rollout was a political strategy.

Let that sink in.

They were willing to kill their own voters to have something to run on in 2022.",3,0,4
1465498334450405380,Omicron: Health experts say Bay Area may be more protected from new COVID variant https://t.co/4iMTCjoy96,0,0,0
1465498327714185220,"Donald Jr., World-Renowned Moron, Urges Vaccine Protests as Omicron Poses “Very High Risk” #SmartNews  https://t.co/fJxeFBYdKR",0,0,0
1465498327596748800,Biden Vaccine Mandate Loses BIG in Court... https://t.co/c31y2lagZb #biden #vaccine #mandate #loses #big #in #court,0,0,0
1465498320323940360,"I'm not ready to die. I'm not going to risk my life or my family members lives. So yeah, if it took a modified vaccine to prevent it from killing me. https://t.co/Lbm3yKpkSj",0,0,0
1465498317912264704,US vaccine mandate for troops survives a legal challenge https://t.co/oZHhVf71tx via @amermilnews,0,0,0
1465498313440911362,"Heritage Foundation sues Biden admin over vaccine mandate
https://t.co/t5gGA7SDyK",40,51,266
1465498295866777600,"I stopped by the pharmacy to get my Covid booster. I had the Moderna shot before, but they only had Pfizer today. They said it was okay to get a different vaccine, so I went ahead and got it, but I hope this isn’t one of those “Don’t mix the grain and the grape” situations.",0,0,0
1465498294797451266,"“Missouri Attorney General Eric Schmitt led a lawsuit, alongside Nebraska, Arkansas, Kansas, Iowa, Wyoming, Alaska, South Dakota, North Dakota and New Hampshire. The lawsuit blocks the federal government from requiring providers in those states to require vaccination for workers.",0,0,0
1465498285213421578,Don’t trust the vaccine but trust the pill still coming from Pfizer…? https://t.co/Qz2O4iFjwJ,0,0,0
1465498279576322048,Why only 10 states?? If it’s unconstitutional in 10 isn’t it unconstitutional in all?@RandPaul  @MassGovernor https://t.co/KGZHRUZIw2,0,0,0
1465498279261712398,These are from the vaccine https://t.co/Nv7mnCCwGt,0,0,0
1465498278066335746,"CBC NEWS puts out Crap! All they talk about is vax vax vax. That Liberal idiot comes on and oh this is terrible it transfers fast this and that, the Journalist said she called S.A. this morning and talked to the Doctor who told her all symptoms were mild and treatable?",0,0,0
1465498276891930630,Vax Horror Stories Continue . https://t.co/mpLqsFJNsv,0,0,0
1465498272336953345,"The COVID-19 vaccine is the first mRNA vaccine, but this type of vaccine has been under study for nearly 2 decades. “These many years of research are what make scientists confident that mRNA vaccines will NOT damage genes.” @HPW235 #HPW235

https://t.co/yQcF9RHtDQ",0,0,0
1465498257170178051,"Vaccine passports = a step toward tyranny.

 https://t.co/aYODgb09Lr",1,0,1
1465498255224188934,"I live in a box without light or sound, can anyone tell me if they had any issues with vaccine 1,2, or 3 ...cause I know this tweet will get 1000 replies and make me feel grandiose.",0,0,2
1465498254871650310,Expert panel considers approving a 'additional dosage' of Covid vaccination for the elderly. - Truenicle https://t.co/ZjTTGvgd40,0,0,0
1465498252858605574,Added the Moderna booster to my collection https://t.co/vhDDnA7C2k,0,0,1
1465498238744768514,"I want the shot they gave Bundy, fuck that weak ass vaccine",0,1,1
1465498229722603520,The CEOs of Moderna and Pfizer being on @CNN the same night terrifies me.,0,0,0
1465498207052435456,With a vaccine strollout (slow rollout) we are well positioned for the Omnicron Covid-19 variant as we have a high percentage of the population vaccinated very recently. Australia once again proving that we are indeed the lucky country.,0,0,0
1465498206129864707,"I am so fucking sick of the scare tactics on covid variants. 

Take care of your body. Eat healthy. Exercise. That is better than any vaccine. 

Omicron? I’m still waiting on the original covid-19 to get me. I’ve been working the entire pandemic and have felt NOTHING.",0,1,0
1465498201004384256,"What will happen next, given waning vaccine immunity? (from Livestream Q... https://t.co/0OZfDgWnJ1 via @YouTube",0,0,0
1465498183597973507,Thank you .@PublicHealthSD staff & thank you @GreaterSudbury staff & thank you to all vaccination clinic volunteers! The success of this collaboration is the success of our City! https://t.co/nxFo1izuFH,1,0,0
1465498175444340736,Can't stop laughing at the vaccine blood clot headlines bc I hear them in a jamaican accent https://t.co/KLTVeIIFgg,0,0,0
1465498170767679488,“it was extremely hard to get access to vaccines especially when you had countries like Canada and the U.S. and various other players ordering vaccines well in advance and in quantities three to four times more than they required”  https://t.co/uiyWOLKOvE,1,1,2
1465498168263651332,Hearing covid vaccine conspiracies irl is even funnier than it is wrong,0,0,0
1465498155697405954,vaccine 2nd dose,0,1,1
1465498140501446660,just got my second dose of pfizer i feel like this https://t.co/uBRHQRE5MU,0,0,3
1465498124768714758,"Why not do a televised townhall where regular people can ask questions about the vaccine directly with our health experts? Discuss fears, dispel myths. @JoeBiden. @VP. @WhiteHouse @SenSchumer. @SpeakerPelosi. @SenateDems. @HouseDemocrats. 
#vaccine. #VaccineMandate. #vaccination",0,0,0
1465498123837521924,#LetsgoBrandon 🤬Nothing is Off the Table': Jen Psaki Warns Americans the Worst Vaccine Mandate Yet May Be Coming https://t.co/bJFBvU5eMK,0,0,0
1465498121807425538,"Ninth Circuit puts brakes on vaccine mandates for San Diego students, California prison guards @hillelaron  https://t.co/yxvJE9g7jp",5,0,0
1465498100970266628,"Looks like this shit-show is affecting my kids before it affects me. Vax for their sport, vax for tertiary. 

I'm so angry about this.",0,3,2
1465498100357754883,"Despite the emergence of Omicron globally, NZ will move to new COVID rules on Friday.

Vax + testing requirements will limit the number of infected people leaving Auckland.

But cases are still likely to spread, write @droneale + his @AucklandUni team.
https://t.co/elPZOcPlgD",1,0,3
1465498094083063809,"What do you think about anti-vaccine persons, hanging out with vaccinated persons, not wearing masks (indoors), because establishments decide not to ask for vaccine proof to their costumers. Or in holiday parties. I see them as contagion vortexes.",0,2,1
1465498092996804609,Busted! https://t.co/08h7YiVe5k,0,0,0
1465498081198329857,Huh. #Vaccine mandates for #kids. #Global #map.  https://t.co/pk6cyQIMCj,0,0,0
1465498080665649154,I just boarded @aircanada flight from Vancouver to Toronto and not a single person asked me for proof of vaccination from the moment I entered the airport to the time I boarded the airplane.,1,9,11
1465498078392340483,Vaccine mandates are just government sponsored violence. https://t.co/Y8PZ0FSvGX,0,0,0
1465498076190154763,"Maybe it won’t be over vaccination, but one day, the government might set an arbitrary rule deeming YOU unfit for your job (because you didn’t do x, y, z…)

This is the fundamental nature of a social credit score. This is where mandatory vax/vax passports, & digital IDs lead.",0,0,0
1465498051653500933,"Exactly. Utterly sick that they are pumping out propaganda of ""polio like symptoms of Covid"" in children to hide the adverse vaccine reactions that will occur giving children these deadly shots. Criminal and unconcionable. https://t.co/xf1B0W5RSX",0,0,1
1465498043747381261,The vax goose steppers credo: if you force us will kill you to save you if we have too! https://t.co/I03qnEMsKD,0,0,0
1465498035786551299,"In the past month I've had a covid vaccine booster, a flu shot, a tetanus shot, and had blood drawn for lab work twice. I'm kinda over getting needles shoved in my arm, hopefully that's it for a while.",0,1,1
1465498015368716301,"Donald Trump Jr., #DonaldTrumpJr World-Renowned Moron, Urges Vaccine Protests as Omicron Poses “Very High Risk”

https://t.co/4cgtImOiew",0,0,0
1465498010016796679,President Biden said South Africa has turned down vaccine doses. But the issue is more complicated than that. https://t.co/KXj7qbqWfg,20,15,38
1465498006233387013,"TODAY my baby got her FIRST dose of the COVID vaccine! Honestly, I was too exhausted to experience any emotion. But it happened💉🎉❤️ https://t.co/LiMZaJUZQs",0,2,9
1465498005180612610,Good thing the booster shoot didn’t hurt welp I think instead of me being 60% water now I’m 60% Vaccine :),0,0,0
1465497991675101190,"If you have had the vaccine don’t ignore chest pains, get checked https://t.co/8TpUjJdNNt",0,0,0
1465497986922909696,"Be strong. Contribute to doing some good. 
Get your vaccines. Thank you.
https://t.co/O6ZmJvU1wR",0,0,0
1465497985886953475,"How dare they question the Vicar of Science, in whom we have been incorporated into by the sacrament of vaccination and whose mark we proudly bear by the mask HAIL HAIL HAIL https://t.co/LYETsm00vA",2,2,19
1465497974264397825,Vaccination day😅,0,0,0
1465497971588534281,This video was to Brought to you by the letters F J B and sponsored by Let’s Go Brandon https://t.co/XFmo5AkQ5N,0,0,0
1465497967259897862,"More than 500,000 jabbed on first day of national vax drive https://t.co/iH6ousRLLs",0,0,0
1465497965108342790,"The Republican's new Culture War: Disease and Death.

They are Mentally unstable.

https://t.co/4gWr1uTPud",0,0,0
1465497964407758848,"""Covid-19: McDonald's requires vaccine pass to dine in under traffic light system""

We just need KFC to follow suit and that's game over for the dine-in fast-food anti-vax. https://t.co/gtSHRPM7ej",0,0,0
1465497949736083460,"Save over 50% on our comfy, reusable masks designed by an RN/Mom https://t.co/SIy3k9NT9e #Vaxxed #VaxAndMask #DesignedbyANurse Show Nurses some Love - vax 
 & wear a mask https://t.co/6tpgUB0VV4",0,0,0
1465497949161598977,"The last November #NetBSD pkgsrc bulk package count:

alpha    22047 (+134)
earm    11566 (+332)
m68k     3074 (+119)
mipsel     5979 (+79)
mips64eb    21592 (+362)
sh3el     7602 (+138)
sparc    18997 (+613)
sparc64    24108 (+308)
vax     3409 (+9)",0,0,1
1465497942052200448,How Jotform facilitates vaccination efforts https://t.co/R66m3m0yJy,0,0,0
1465497941439918084,LA begins enforcing strict mandate requiring proof of vax - https://t.co/FvHdU6GcGH #VIXC #Commentary #eWeatherNews https://t.co/yOck9wucZV,0,0,0
1465497939732840453,How Jotform facilitates vaccination efforts https://t.co/ZvO1OFRYcI,0,0,0
1465497939502108675,"🔴 Judge Shuts Down Biden's COVID-19 Vaccine Mandate for Health Care Workers in 10 States

https://t.co/peiLKsNwz5",0,0,0
1465497926470451203,Moderna plans to produce a booster vaccine shot specifically for the new coronavirus variant Omicron https://t.co/A4cAlhMfrm,0,0,0
1465497906765606914,Another Equestrian affected by adverse vaccine drug reactions 😢 🐴 Cienna Knowles: Healthy 19-Year-Old Hospitalized With Blood Clots After Second Pfizer COVID-19 Vaccine https://t.co/N2vOSMPzVw,0,0,0
1465497902843785218,Yep! The vaccine IS THE DISEASE! https://t.co/i9snQt4LQc,1,0,2
1465497899970797574,Moderna Reveals Strategy to Neutralize Omicron Variant #SmartNews  https://t.co/1ttu60wubx,0,0,0
1465497895336136704,The COVID vaccine might not protect you from this new variant https://t.co/A1SS8Rr8Yx,0,0,0
